{
  "subject": {
    "kit": {
      "id": "terminal-common",
      "version": "0.0.1"
    }
  },
  "result": "passed",
  "validator": {
    "name": "soksak-conformance",
    "version": "0.0.1"
  },
  "artifacts": [
    {
      "target": "any",
      "sha256": "4444444444444444444444444444444444444444444444444444444444444444"
    }
  ],
  "claim": {
    "manifest": true
  }
}
