{
  "subject": {
    "plugin": {
      "id": "weather-plugin",
      "version": "0.0.1"
    }
  },
  "result": "passed",
  "validator": {
    "name": "soksak-conformance",
    "version": "0.0.1"
  },
  "artifacts": [
    {
      "target": "any",
      "sha256": "1111111111111111111111111111111111111111111111111111111111111111"
    }
  ],
  "claim": {
    "release": true
  }
}
