{
  "subject": {
    "sidecar": {
      "id": "weather-sidecar",
      "version": "0.0.1"
    }
  },
  "result": "passed",
  "validator": {
    "name": "soksak-conformance",
    "version": "0.0.1"
  },
  "artifacts": [
    {
      "target": "aarch64-apple-darwin",
      "sha256": "2222222222222222222222222222222222222222222222222222222222222222"
    },
    {
      "target": "x86_64-unknown-linux-gnu",
      "sha256": "3333333333333333333333333333333333333333333333333333333333333333"
    }
  ],
  "claim": {
    "contract": {
      "id": "soksak-spec-sidecar-weather",
      "version": "0.0.1"
    }
  }
}
